{
  "$schema": "urn:oxyflut:staged:sample-validity:1",
  "schemaVersion": "1.0.0",
  "lockDigest": "93364eb345914cf8471257c0a1bce087abc3f0c796d825d725b4b44e0479ac33",
  "environment": "macos",
  "candidate": "focused",
  "meterVersion": "synthetic-meter-v1",
  "exclusionCategories": [
    "measurement-tool-failure",
    "unrelated-os-interruption",
    "physical-disconnect"
  ],
  "rules": [
    {
      "constraintId": "CON-PERF-001",
      "statistic": "nearest-rank",
      "percentile": 99,
      "unit": "ms",
      "retainAllValidObservations": true
    },
    {
      "constraintId": "CON-PERF-001",
      "statistic": "maximum-bound",
      "unit": "ms",
      "retainAllValidObservations": true
    }
  ]
}
